onoma_ekthesis,perigrafi,imerominia_enarxis,imerominia_liksis,link,aithousa
Vincent Van Gogh: Paris,"Η συγκεκριμένη έκθεση αποτελεί αφιέρωμα στα έργα που ο Van Gogh υλοποίησε την περίοδο κατά την οποία βρισκόταν στο Παρίσι. Συνεργατικά με άλλες πινακοθήκες της χώρας προβάλλονται τα σημαντικότερά του έργα, της εποχής εκείνης, στα οποία φαίνεται η επιρροή του ιμπρεσιονισμού καθώς και της ιαπωνικής κουλτούρας.",2024-07-25,2024-08-31,http://www.vggallery.com/painting/f_0372.jpg,1
Οι επιρροές του Van Gogh σε άλλους καλλιτέχνες,"Ο σπουδαίος αυτός καλλιτέχνης μέσα από το έργο του "άγγιξε" πολλούς από τους συναδέλφους του στον χώρο, γεγονός που επιβεβαιώνεται σε αυτή την έκθεση. Συγκεκριμένα περιέχονται πίνακες που υλοποίησαν άλλοι, επηρεασμένοι είτε από κάποιο έργο του, είτε από τον ίδιο, ζωγραφίζοντάς τον.",2024-06-19,2024-08-01,http://www.vggallery.com/inspired/images/gauguin.jpg,2
Portraits,"Κατά την διάρκεια της ζωής και του έργου του ο Van Gogh πολλές φορές αποτύπωσε τον εαυτό του σε καμβά, καθώς και άλλους κοντινούς του ανθρώπους, ή ακόμα και ξένους. Η συγκεκριμένη έκθεση αποτελεί αφιέρωμα σε όλες τις αυτοπροσωπογραφίες και πορτρέτα που φιλοξενεί η πινακοθήκη μας.",2024-05-31,2024-07-05,http://www.vggallery.com/painting/f_0207a.jpg,3
Τα πρώτα εκατό έργα του Van Gogh,Η συγκεκριμένη έκθεση παρουσιάζει τους πίνακες που αποτέλεσαν την αρχή της καριέρας του Vincent Van Gogh με λεπτομερή περιγραφή του καθενός.,2024-06-14,2024-07-24,"https://iiif.micr.io/wztKL/full/1800,/0/default.webp",1
Αφιέρωμα στον Paul Gauguin,"O Paul ήταν ένας πολύ κοντινός φίλος του Van Gogh και εκπρόσωπος του ρεύματος του μεταϊμπρεσιονισμού που επηρέασε τα ρεύματα της μοντέρνας τέχνης. Το αφιέρωμα αυτό περιλαμβάνει τα δημοφιλέστερα έργα ενός απ’ τους σημαντικότερους (όπως θεωρήθηκε) ζωγράφους των δύο τελευταίων αιώνων.",2024-07-03,2024-08-30,3
